<?xml version="1.0" encoding="UTF-8" standalone="yes"?>

<!--

	Назначение файла	:
	Ревизия				: 1.0.1 (Beta)
	Версия клиента		: 2.5 (Иннова)

 -->

<xs:schema version="1.0" xmlns:xs="http://www.w3.org/2001/XMLSchema">
	<xs:element name="player_experience_table">
		<xs:complexType>
			<xs:sequence>
				<xs:element name="exp" type="xs:long" minOccurs="0" maxOccurs="unbounded" />
			</xs:sequence>
		</xs:complexType>
	</xs:element>
</xs:schema>